description,progress,created_at,outcome
"Emprendimiento de venta de dulces artesanales con enfoque en clientes jóvenes",25,2025-10-01,Bajo éxito
"Aplicación móvil para conectar pequeños productores con clientes locales",60,2025-09-15,Medio éxito
"Plataforma de inversión para startups de tecnología",85,2025-08-01,Alto éxito
"Tienda online de ropa reciclada con enfoque ecológico",55,2025-09-20,Medio éxito
"Proyecto de energía solar para zonas rurales",90,2025-07-10,Alto éxito
"Emprendimiento sin descripción ni avance",5,2025-10-30,Bajo éxito
"Desarrollo de prototipo para sistema de riego inteligente",70,2025-09-05,Medio éxito
"Servicio de consultoría para emprendedores",80,2025-08-15,Alto éxito
